{"checkpoint_id":"a10m5r3-family-splice-s314159","corpus_cursor":{"epoch_order_sha256":"5863f2923817d696d4ee140976095442d89ae55e821a49634b407de71ffcc536","next_batch":0},"created_utc":"2026-07-18T21:05:37.003559+00:00","epoch":99,"global_step":1188,"model_id":"a10m5r3-family-splice-s314159","payload_bytes":707452,"payload_sha256":"cc88c3ce98e6a3ba329750246aa977c6067b4bfa653dad219208caec99622773","schema_version":1,"state":{"model":true,"optimizer":true,"rng":true,"sampler":true,"scaler":true,"scheduler":true},"training_seed":314159}
