{"checkpoint_id":"a10m5r3-family-lognormal-s147031","corpus_cursor":{"epoch_order_sha256":"a87dbd9cb8dc8818152df2684751c63b0841f4787b6d09af989755cafb2378d1","next_batch":0},"created_utc":"2026-07-18T20:28:02.836176+00:00","epoch":99,"global_step":1188,"model_id":"a10m5r3-family-lognormal-s147031","payload_bytes":705084,"payload_sha256":"e349499f7be1e0a1b6b21b21e58a650e432507b1edd4680d8f7953b2899a82d1","schema_version":1,"state":{"model":true,"optimizer":true,"rng":true,"sampler":true,"scaler":true,"scheduler":true},"training_seed":147031}
