{"checkpoint_id":"a10m5-N1-l32-w128-d2-lognormal-seed147031","corpus_cursor":{"epoch_order_sha256":"f9182b95c364222bb9554601bc52fbaa99a75e843f99d4dff1fb99d08cd0d1d5","next_batch":0},"created_utc":"2026-07-18T16:53:52.990143+00:00","epoch":100,"global_step":1200,"model_id":"a10m5-N1-l32-w128-d2-lognormal-seed147031","payload_bytes":2284936,"payload_sha256":"967b99c101577b6db0b6ce75f065ef9355feee13ac418e7df88f340f600dd105","schema_version":1,"state":{"model":true,"optimizer":true,"rng":true,"sampler":true,"scaler":true,"scheduler":true},"training_seed":147031}
