{"checkpoint_id":"a10m5r3-capacity-p3-s147031","corpus_cursor":{"epoch_order_sha256":"43a2472607f0848e001b8adae835d066599fd83ec2ded71876254c1b9b8fe14f","next_batch":0},"created_utc":"2026-07-18T21:38:25.012671+00:00","epoch":65,"global_step":780,"model_id":"a10m5r3-capacity-p3-s147031","payload_bytes":11735036,"payload_sha256":"1e1d75a41a6f483fa5a72fbae2e015225aeecac25ec467d8b8f667137b4bb6a8","schema_version":1,"state":{"model":true,"optimizer":true,"rng":true,"sampler":true,"scaler":true,"scheduler":true},"training_seed":147031}
