{"checkpoint_id":"a10m5-N1-l64-w128-d3-lognormal-seed147031","corpus_cursor":{"epoch_order_sha256":"2b5b38eade5c51e1e05263cbe64256268269b6381266eeb8f12b0a7c4d073fc8","next_batch":0},"created_utc":"2026-07-18T10:53:00.882885+00:00","epoch":97,"global_step":1164,"model_id":"a10m5-N1-l64-w128-d3-lognormal-seed147031","payload_bytes":2751520,"payload_sha256":"d9d86d99929dc7d4ddb18b23c7765792cefef589c3a7d7dcafdacf9477b48d4f","schema_version":1,"state":{"model":true,"optimizer":true,"rng":true,"sampler":true,"scaler":true,"scheduler":true},"training_seed":147031}
