{"checkpoint_id":"a10m5-N1-l64-w128-d3-gpd-seed147031","corpus_cursor":{"epoch_order_sha256":"f9182b95c364222bb9554601bc52fbaa99a75e843f99d4dff1fb99d08cd0d1d5","next_batch":0},"created_utc":"2026-07-18T11:02:34.766521+00:00","epoch":100,"global_step":1200,"model_id":"a10m5-N1-l64-w128-d3-gpd-seed147031","payload_bytes":2751520,"payload_sha256":"f86952ce2e2afe8bd1afae8be4ac9f889a12b072fc1d417518b2719058ea4a0d","schema_version":1,"state":{"model":true,"optimizer":true,"rng":true,"sampler":true,"scaler":true,"scheduler":true},"training_seed":147031}
